{
  "contract_version": "1.1.0",
  "generated_at": "2026-08-11",
  "catalog_scope": {
    "institute_active_course_families": 29,
    "institute_active_options": 49,
    "diploma_active_course_identities": 14,
    "total_active_course_identities": 43
  },
  "policy": {
    "course_master_survives_missing_syllabus": true,
    "missing_syllabus_blocks_only": [
      "syllabus",
      "subjects",
      "papers",
      "module_detail"
    ],
    "missing_assessment_blocks_only": [
      "assessment",
      "exam_pattern",
      "marks",
      "passing_rules"
    ],
    "never_infer_topics_from_generated_seo_copy": true
  },
  "source_register": [
    {
      "source_id": "src.phase1.current_approval",
      "type": "approved_decision",
      "title": "Phase 1 canonical decisions confirmed 2026-08-11"
    },
    {
      "source_id": "src.institute.approved_source_pack",
      "type": "local_source_pack",
      "title": "Approved Institute Phase 1 source pack"
    },
    {
      "source_id": "src.university.syllabus_index",
      "type": "official_university_web",
      "url": "https://abvhv.edu.in/study-centre-course/syllabus",
      "observed_at": "2026-08-11"
    }
  ],
  "records": [
    {
      "course_key": "institute_basic_health_care",
      "target_site": "atal_institute",
      "syllabus": {
        "status": "AVAILABLE_APPROVED_REFERENCE",
        "content_mode": "CANONICAL_SOURCE_DOCUMENT",
        "source_refs": [
          "src.phase1.current_approval",
          "src.institute.approved_source_pack"
        ]
      },
      "assessment": {
        "status": "AVAILABLE_IN_APPROVED_REFERENCE",
        "source_refs": [
          "src.phase1.current_approval",
          "src.institute.approved_source_pack"
        ]
      },
      "blocked_intents": [],
      "course_master_blocked": false
    },
    {
      "course_key": "institute_hospital_management",
      "target_site": "atal_institute",
      "syllabus": {
        "status": "AVAILABLE_APPROVED_REFERENCE",
        "content_mode": "CANONICAL_SOURCE_DOCUMENT",
        "source_refs": [
          "src.phase1.current_approval",
          "src.institute.approved_source_pack"
        ]
      },
      "assessment": {
        "status": "AVAILABLE_IN_APPROVED_REFERENCE",
        "source_refs": [
          "src.phase1.current_approval",
          "src.institute.approved_source_pack"
        ]
      },
      "blocked_intents": [],
      "course_master_blocked": false
    },
    {
      "course_key": "institute_first_aid_care",
      "target_site": "atal_institute",
      "syllabus": {
        "status": "AVAILABLE_APPROVED_REFERENCE",
        "content_mode": "CANONICAL_SOURCE_DOCUMENT",
        "source_refs": [
          "src.phase1.current_approval",
          "src.institute.approved_source_pack"
        ]
      },
      "assessment": {
        "status": "AVAILABLE_IN_APPROVED_REFERENCE",
        "source_refs": [
          "src.phase1.current_approval",
          "src.institute.approved_source_pack"
        ]
      },
      "blocked_intents": [],
      "course_master_blocked": false
    },
    {
      "course_key": "institute_natural_pharmacy",
      "target_site": "atal_institute",
      "syllabus": {
        "status": "AVAILABLE_APPROVED_REFERENCE",
        "content_mode": "CANONICAL_SOURCE_DOCUMENT",
        "source_refs": [
          "src.phase1.current_approval",
          "src.institute.approved_source_pack"
        ]
      },
      "assessment": {
        "status": "AVAILABLE_IN_APPROVED_REFERENCE",
        "source_refs": [
          "src.phase1.current_approval",
          "src.institute.approved_source_pack"
        ]
      },
      "blocked_intents": [],
      "course_master_blocked": false
    },
    {
      "course_key": "institute_pg_basic_health_care",
      "target_site": "atal_institute",
      "syllabus": {
        "status": "AVAILABLE_APPROVED_REFERENCE",
        "content_mode": "CANONICAL_SOURCE_DOCUMENT",
        "source_refs": [
          "src.phase1.current_approval",
          "src.institute.approved_source_pack"
        ]
      },
      "assessment": {
        "status": "AVAILABLE_IN_APPROVED_REFERENCE",
        "source_refs": [
          "src.phase1.current_approval",
          "src.institute.approved_source_pack"
        ]
      },
      "blocked_intents": [],
      "course_master_blocked": false
    },
    {
      "course_key": "institute_pg_hospital_management",
      "target_site": "atal_institute",
      "syllabus": {
        "status": "AVAILABLE_APPROVED_REFERENCE",
        "content_mode": "CANONICAL_SOURCE_DOCUMENT",
        "source_refs": [
          "src.phase1.current_approval",
          "src.institute.approved_source_pack"
        ]
      },
      "assessment": {
        "status": "AVAILABLE_IN_APPROVED_REFERENCE",
        "source_refs": [
          "src.phase1.current_approval",
          "src.institute.approved_source_pack"
        ]
      },
      "blocked_intents": [],
      "course_master_blocked": false
    },
    {
      "course_key": "institute_pg_dietetics_nutrition_management",
      "target_site": "atal_institute",
      "syllabus": {
        "status": "AVAILABLE_APPROVED_REFERENCE",
        "content_mode": "CANONICAL_SOURCE_DOCUMENT",
        "source_refs": [
          "src.phase1.current_approval",
          "src.institute.approved_source_pack"
        ]
      },
      "assessment": {
        "status": "AVAILABLE_IN_APPROVED_REFERENCE",
        "source_refs": [
          "src.phase1.current_approval",
          "src.institute.approved_source_pack"
        ]
      },
      "blocked_intents": [],
      "course_master_blocked": false
    },
    {
      "course_key": "institute_dialysis_technology",
      "target_site": "atal_institute",
      "syllabus": {
        "status": "AVAILABLE_APPROVED_REFERENCE",
        "content_mode": "CANONICAL_SOURCE_DOCUMENT",
        "source_refs": [
          "src.phase1.current_approval",
          "src.institute.approved_source_pack"
        ]
      },
      "assessment": {
        "status": "AVAILABLE_IN_APPROVED_REFERENCE",
        "source_refs": [
          "src.phase1.current_approval",
          "src.institute.approved_source_pack"
        ]
      },
      "blocked_intents": [],
      "course_master_blocked": false
    },
    {
      "course_key": "institute_ecg_cardiac_care",
      "target_site": "atal_institute",
      "syllabus": {
        "status": "AVAILABLE_APPROVED_REFERENCE",
        "content_mode": "CANONICAL_SOURCE_DOCUMENT",
        "source_refs": [
          "src.phase1.current_approval",
          "src.institute.approved_source_pack"
        ]
      },
      "assessment": {
        "status": "AVAILABLE_IN_APPROVED_REFERENCE",
        "source_refs": [
          "src.phase1.current_approval",
          "src.institute.approved_source_pack"
        ]
      },
      "blocked_intents": [],
      "course_master_blocked": false
    },
    {
      "course_key": "institute_first_aid_emergency_care",
      "target_site": "atal_institute",
      "syllabus": {
        "status": "AVAILABLE_APPROVED_REFERENCE",
        "content_mode": "CANONICAL_SOURCE_DOCUMENT",
        "source_refs": [
          "src.phase1.current_approval",
          "src.institute.approved_source_pack"
        ]
      },
      "assessment": {
        "status": "AVAILABLE_IN_APPROVED_REFERENCE",
        "source_refs": [
          "src.phase1.current_approval",
          "src.institute.approved_source_pack"
        ]
      },
      "blocked_intents": [],
      "course_master_blocked": false
    },
    {
      "course_key": "institute_hospital_healthcare_administration",
      "target_site": "atal_institute",
      "syllabus": {
        "status": "AVAILABLE_APPROVED_REFERENCE",
        "content_mode": "CANONICAL_SOURCE_DOCUMENT",
        "source_refs": [
          "src.phase1.current_approval",
          "src.institute.approved_source_pack"
        ]
      },
      "assessment": {
        "status": "AVAILABLE_IN_APPROVED_REFERENCE",
        "source_refs": [
          "src.phase1.current_approval",
          "src.institute.approved_source_pack"
        ]
      },
      "blocked_intents": [],
      "course_master_blocked": false
    },
    {
      "course_key": "institute_medical_billing_coding",
      "target_site": "atal_institute",
      "syllabus": {
        "status": "AVAILABLE_APPROVED_REFERENCE",
        "content_mode": "CANONICAL_SOURCE_DOCUMENT",
        "source_refs": [
          "src.phase1.current_approval",
          "src.institute.approved_source_pack"
        ]
      },
      "assessment": {
        "status": "AVAILABLE_IN_APPROVED_REFERENCE",
        "source_refs": [
          "src.phase1.current_approval",
          "src.institute.approved_source_pack"
        ]
      },
      "blocked_intents": [],
      "course_master_blocked": false
    },
    {
      "course_key": "institute_medical_record_front_office_management",
      "target_site": "atal_institute",
      "syllabus": {
        "status": "AVAILABLE_APPROVED_REFERENCE",
        "content_mode": "CANONICAL_SOURCE_DOCUMENT",
        "source_refs": [
          "src.phase1.current_approval",
          "src.institute.approved_source_pack"
        ]
      },
      "assessment": {
        "status": "AVAILABLE_IN_APPROVED_REFERENCE",
        "source_refs": [
          "src.phase1.current_approval",
          "src.institute.approved_source_pack"
        ]
      },
      "blocked_intents": [],
      "course_master_blocked": false
    },
    {
      "course_key": "institute_nursing_patient_care",
      "target_site": "atal_institute",
      "syllabus": {
        "status": "AVAILABLE_APPROVED_REFERENCE",
        "content_mode": "CANONICAL_SOURCE_DOCUMENT",
        "source_refs": [
          "src.phase1.current_approval",
          "src.institute.approved_source_pack"
        ]
      },
      "assessment": {
        "status": "AVAILABLE_IN_APPROVED_REFERENCE",
        "source_refs": [
          "src.phase1.current_approval",